{"schema_version":3,"provider_id":"hce_tcu","source_files":{"exams":{"2026.json":5489},"papers":{"2026.json":18507}},"bundle_ids":["hce-tcu-post-baccalaureate-medical-not-applicable-hce-tcu"],"canonical_ids":["hce-tcu"],"raw_events":[["hce-tcu-115",2026,true]],"papers":[["hce-tcu-115","post-bacc-chinese-medicine","chinese","question",115,0,0,"eb4e132c6e6e7a6c178ddb6a57ddcd893bd106477873f35da9e7aae143d8e590","providers/hce_tcu/115/hce-tcu-115/post-bacc-chinese-medicine/chinese/question.pdf","post-bacc-chinese-medicine-chinese-question",false,115,"administered","exam_year",false],["hce-tcu-115","post-bacc-chinese-medicine","chinese","answer",115,0,0,"f03fc906be2447a8a3f35bdf0ff86b40a746cc8a3a36e56ad16252d95e78ac4d","providers/hce_tcu/115/hce-tcu-115/post-bacc-chinese-medicine/chinese/answer.pdf","post-bacc-chinese-medicine-chinese-answer",false,115,"administered","exam_year",false],["hce-tcu-115","post-bacc-chinese-medicine","chemistry","question",115,0,0,"b5713e55ec3477b1a673f0a75e8c160e0e6f38ed3ab0145c85f1936a522bd3bb","providers/hce_tcu/115/hce-tcu-115/post-bacc-chinese-medicine/chemistry/question.pdf","post-bacc-chinese-medicine-chemistry-question",false,115,"administered","exam_year",false],["hce-tcu-115","post-bacc-chinese-medicine","chemistry","answer",115,0,0,"bb89c665e6fee46871037375625e83de50fda4873e4568d655b363f6601b1533","providers/hce_tcu/115/hce-tcu-115/post-bacc-chinese-medicine/chemistry/answer.pdf","post-bacc-chinese-medicine-chemistry-answer",false,115,"administered","exam_year",false],["hce-tcu-115","post-bacc-chinese-medicine","english","question",115,0,0,"a8019d21c93f3c3cc4ebff3c5e4c2a9ad0de269196f7563d4d2c77716f802e1f","providers/hce_tcu/115/hce-tcu-115/post-bacc-chinese-medicine/english/question.pdf","post-bacc-chinese-medicine-english-question",false,115,"administered","exam_year",false],["hce-tcu-115","post-bacc-chinese-medicine","english","answer",115,0,0,"687133c3d05ad7803bad9d29ac34a5721cf1bdee7d3412276089170d81c21311","providers/hce_tcu/115/hce-tcu-115/post-bacc-chinese-medicine/english/answer.pdf","post-bacc-chinese-medicine-english-answer",false,115,"administered","exam_year",false],["hce-tcu-115","post-bacc-chinese-medicine","biology","question",115,0,0,"b9fd9a8424c6c2c3467dd50f7fac5bda07370387cb18b245b7aa37bee6fa77cd","providers/hce_tcu/115/hce-tcu-115/post-bacc-chinese-medicine/biology/question.pdf","post-bacc-chinese-medicine-biology-question",false,115,"administered","exam_year",false],["hce-tcu-115","post-bacc-chinese-medicine","biology","answer",115,0,0,"207eae543c680d782e80282ddf1a08896722579fcb358e818c4fee4e4d8ddfc0","providers/hce_tcu/115/hce-tcu-115/post-bacc-chinese-medicine/biology/answer.pdf","post-bacc-chinese-medicine-biology-answer",false,115,"administered","exam_year",false],["hce-tcu-115","post-bacc-chinese-medicine","all","answer_clarification",115,0,0,"edbbe9abbe9324918fae069d1f5d2ae120f54d450b6a637a1f6c4ab17c2effd0","providers/hce_tcu/115/hce-tcu-115/post-bacc-chinese-medicine/all/answer_clarification.pdf","post-bacc-chinese-medicine-all-answer_clarification",false,115,"administered","exam_year",false]]}